{
  "$schema": "./docs-protocol-policy.schema.json",
  "schema_version": 3,
  "snapshot_revision": "2026-08-17.6",
  "observed_at": "2026-08-17",
  "organization": "agent-teams-ai",
  "inventory_snapshot_revision": "2026-08-17.1",
  "continuous_audit": false,
  "protocol": {
    "package": "@agent-teams/docs-protocol",
    "producer_repository": "agent-teams-ai/engineering-foundation",
    "producer_is_consumer": false,
    "version_policy": "exact_registry_version",
    "fixed_gate_command": "pnpm docs:protocol:check",
    "reusable_workflow": ".github/workflows/docs-protocol-check.yml"
  },
  "admission": {
    "expected_repository_count": 8,
    "owned_repository_count": 7,
    "external_repository_count": 1,
    "fork_source_count": 1,
    "new_owned_repository_status": "pending_classification",
    "qualification_evidence_required": true,
    "live_drift_audit": {
      "status": "unavailable_without_dedicated_read_only_org_credential",
      "required_credential": "dedicated_read_only_org_inventory_credential",
      "forbidden_credentials": [
        "CODEX_AUTH_JSON",
        "REVIEWROUTER_CODEX_AUTH_JSON",
        "interactive_user_gh_token"
      ]
    }
  },
  "repositories": [
    {
      "repository": "agent-teams-ai/.github",
      "repository_id": 1316243981,
      "source_provenance": { "kind": "original", "parent_repository": null },
      "governance_ownership": "organization_owned",
      "repository_lifecycle": "active",
      "docs_role": "governance_controller",
      "protocol_required": false,
      "admission_status": "not_applicable",
      "exact_package_version": null,
      "exact_foundation_version": null,
      "cohort_binding_status": "not_applicable",
      "desired_cohort_id": null,
      "observed_cohort_id": null,
      "observed_cohort_record_digest": null,
      "observed_cohort_event_digest": null,
      "profile_path": null,
      "caller_workflow_path": null,
      "reusable_workflow_revision": null,
      "qualification_evidence_path": null,
      "fixed_gate_command": null,
      "required_check_context": null,
      "observed_default_branch_evidence": null,
      "qualification": {
        "status": "not_applicable",
        "observed_revision": null,
        "evidence_paths": []
      },
      "exemption": null,
      "required_check_exception_id": null
    },
    {
      "repository": "agent-teams-ai/agent-runtime",
      "repository_id": 1314129620,
      "source_provenance": { "kind": "original", "parent_repository": null },
      "governance_ownership": "organization_owned",
      "repository_lifecycle": "active",
      "docs_role": "consumer",
      "protocol_required": true,
      "admission_status": "admitted",
      "exact_package_version": "0.1.0-rc.1",
      "exact_foundation_version": "0.16.1",
      "cohort_binding_status": "legacy_pre_cohort",
      "desired_cohort_id": null,
      "observed_cohort_id": null,
      "observed_cohort_record_digest": null,
      "observed_cohort_event_digest": null,
      "profile_path": "architecture/foundation/docs-protocol.yaml",
      "caller_workflow_path": ".github/workflows/docs-protocol.yml",
      "reusable_workflow_revision": "2679c8bc1e432091271d2f68ef904694e4d5838e",
      "qualification_evidence_path": "architecture/foundation/docs-protocol-qualification.json",
      "fixed_gate_command": "pnpm docs:protocol:check",
      "required_check_context": null,
      "observed_default_branch_evidence": null,
      "qualification": {
        "status": "qualified",
        "observed_revision": "91d1e6687dc94801c5d2de8cd4939865615c990f",
        "evidence_paths": [
          "package.json",
          "architecture/foundation/docs-protocol.yaml",
          ".github/workflows/docs-protocol.yml",
          "architecture/foundation/docs-protocol-qualification.json"
        ]
      },
      "exemption": null,
      "required_check_exception_id": null
    },
    {
      "repository": "agent-teams-ai/agent-teams-orchestrator",
      "repository_id": 1310245598,
      "source_provenance": { "kind": "original", "parent_repository": null },
      "governance_ownership": "organization_owned",
      "repository_lifecycle": "active",
      "docs_role": "consumer",
      "protocol_required": true,
      "admission_status": "admitted",
      "exact_package_version": "0.1.0-rc.1",
      "exact_foundation_version": "0.16.1",
      "cohort_binding_status": "legacy_pre_cohort",
      "desired_cohort_id": null,
      "observed_cohort_id": null,
      "observed_cohort_record_digest": null,
      "observed_cohort_event_digest": null,
      "profile_path": "architecture/foundation/docs-protocol.yaml",
      "caller_workflow_path": ".github/workflows/docs-protocol.yml",
      "reusable_workflow_revision": "2679c8bc1e432091271d2f68ef904694e4d5838e",
      "qualification_evidence_path": "architecture/foundation/docs-protocol-qualification.json",
      "fixed_gate_command": "pnpm docs:protocol:check",
      "required_check_context": null,
      "observed_default_branch_evidence": null,
      "qualification": {
        "status": "qualified",
        "observed_revision": "fdd47cbc0bc1a2177060200db00bb435e0d79f76",
        "evidence_paths": [
          "package.json",
          "architecture/foundation/docs-protocol.yaml",
          ".github/workflows/docs-protocol.yml",
          "architecture/foundation/docs-protocol-qualification.json"
        ]
      },
      "exemption": null,
      "required_check_exception_id": null
    },
    {
      "repository": "agent-teams-ai/agent-teams-platform",
      "repository_id": 1319378484,
      "source_provenance": { "kind": "original", "parent_repository": null },
      "governance_ownership": "organization_owned",
      "repository_lifecycle": "active",
      "docs_role": "consumer",
      "protocol_required": true,
      "admission_status": "admitted",
      "exact_package_version": "0.1.0-rc.1",
      "exact_foundation_version": "0.16.1",
      "cohort_binding_status": "legacy_pre_cohort",
      "desired_cohort_id": null,
      "observed_cohort_id": null,
      "observed_cohort_record_digest": null,
      "observed_cohort_event_digest": null,
      "profile_path": "architecture/foundation/docs-protocol.yaml",
      "caller_workflow_path": ".github/workflows/docs-protocol.yml",
      "reusable_workflow_revision": "2679c8bc1e432091271d2f68ef904694e4d5838e",
      "qualification_evidence_path": "architecture/foundation/docs-protocol-qualification.json",
      "fixed_gate_command": "pnpm docs:protocol:check",
      "required_check_context": null,
      "observed_default_branch_evidence": null,
      "qualification": {
        "status": "qualified",
        "observed_revision": "001dcdc39067be55b93b7faf7b432f901d1d85b5",
        "evidence_paths": [
          "package.json",
          "architecture/foundation/docs-protocol.yaml",
          ".github/workflows/docs-protocol.yml",
          "architecture/foundation/docs-protocol-qualification.json"
        ]
      },
      "exemption": null,
      "required_check_exception_id": "platform-private-required-checks-github-free"
    },
    {
      "repository": "agent-teams-ai/craig-meeting-gateway",
      "repository_id": 1319652670,
      "source_provenance": { "kind": "fork", "parent_repository": "CraigChat/craig" },
      "governance_ownership": "external",
      "repository_lifecycle": "active",
      "docs_role": "not_applicable",
      "protocol_required": false,
      "admission_status": "exception",
      "exact_package_version": null,
      "exact_foundation_version": null,
      "cohort_binding_status": "not_applicable",
      "desired_cohort_id": null,
      "observed_cohort_id": null,
      "observed_cohort_record_digest": null,
      "observed_cohort_event_digest": null,
      "profile_path": null,
      "caller_workflow_path": null,
      "reusable_workflow_revision": null,
      "qualification_evidence_path": null,
      "fixed_gate_command": null,
      "required_check_context": null,
      "observed_default_branch_evidence": null,
      "qualification": {
        "status": "not_applicable",
        "observed_revision": null,
        "evidence_paths": []
      },
      "exemption": {
        "id": "external-fork-docs-protocol",
        "reason": "Upstream fork is not an Agent Teams-owned product and must not receive organization-specific documentation machinery.",
        "review_triggers": [
          "fork_detached",
          "ownership_changed",
          "organization_specific_docs_added"
        ]
      },
      "required_check_exception_id": null
    },
    {
      "repository": "agent-teams-ai/docs-protocol-canary-20260817",
      "repository_id": 1336577313,
      "source_provenance": {
        "kind": "original",
        "parent_repository": null
      },
      "governance_ownership": "organization_owned",
      "repository_lifecycle": "active",
      "docs_role": "consumer",
      "protocol_required": true,
      "admission_status": "admitted",
      "exact_package_version": "0.1.0-rc.5",
      "exact_foundation_version": "0.17.0-rc.3",
      "cohort_binding_status": "rollout_pending",
      "desired_cohort_id": "docs-2026-08-17-rc9",
      "observed_cohort_id": "docs-2026-08-17-rc7",
      "observed_cohort_record_digest": "sha256:55afadf793fb62703934082c2fe682a6f678ef92ad8cd2f58d1d2d80e007c836",
      "observed_cohort_event_digest": "sha256:d24c95a0d708ec9f72340181b4cb830560ad3f44429f8df8eb65032549c57d2e",
      "profile_path": "architecture/foundation/docs-protocol.yaml",
      "caller_workflow_path": ".github/workflows/docs-protocol.yml",
      "reusable_workflow_revision": "57e03681e820fd0378600b5169acfa1514d1065a",
      "qualification_evidence_path": "architecture/foundation/docs-protocol-qualification.json",
      "fixed_gate_command": "pnpm docs:protocol:check",
      "required_check_context": "docs-protocol / docs-protocol-check",
      "observed_default_branch_evidence": {
        "default_branch": "main",